id,keyword,location,text,target
5040,eyewitness,Washington,on anniversary of hiroshima bombing illustrated timeline of bombings eyewitness account particularly horrifying,1
5041,eyewitness,Los Angeles CA USA,aug 06 2015 radio show articles 1 eyewitness account of abortion organ harvesting by planned parenthood,0
5046,eyewitness,UK,rt patrickjbutler excellent damiengayle eyewitness account of kids company closure you drop the bomb and expect,1
5049,eyewitness,Pennsylvania,a true tbt eyewitness news wbre wyou,0
5052,eyewitness,South Africa,its lights out again with stagetwo load shedding stagetwo load shedding will be in force between 5pm and 10pm,0
5056,eyewitness,Orlando Fl,wftv eyewitness news fbi man who stole us secrets married honduran minors for sex,0
5059,eyewitness,New York,freed bokoharam captives speak up i will make sure she goes to school guardian,0
5060,eyewitness,South Africa,i tried to save mido macia one of the murder accused has testified he tried to save mido macias life,0
5062,famine,Florida but I wanna be n Texas,oct336 guys these bitches aint famine then,0
5063,famine,New York,food crematoria provoke outrage amid crisis famine memories,1
5064,famine,Kyiv Ukraine,russia food crematoria provoke outrage in country wsoaring poverty soviet famine memory,1
5068,famine,JamDung,ppl like unu feast today and famine tomorrow,0
5069,famine,Panam,top 3 turn on the darkness king redeem queen serene famine wolf,0
5073,famine,Washington,a memorial to the millions who perished in the holodomor has been erected in the us capital,1
5074,famine,Earth Milky Way Universe,exporting food wont solve the problem africans will end famine n poverty by solving out of control tribal wars,1
5078,famine,EdappallyKochi,building muscle with feast and famine feeding most diet plans are based around losing weight but what should you,0
5079,famine,Texas,the famine is coming to an end bluebell,1
5080,famine,In Fairie where else,she tasted like a feast after a famine and he was starving trusting jack writes4coffee,0
5083,famine,Massachusetts,russia destroys food while people go hungry were not the only ones with an insane government,1
5087,famine,Ukraine,reuters russian food crematoria provoke outrage amid crisis famine memories,1
5094,famine,USA,russian food crematoria provoke outrage amid crisis famine memories,1
5095,famine,Ireland,ive experienced the smell of rotting potatoes for the first time the famine must have been awful if the whole country smelled like that,1
5096,famine,San Francisco,,1
5098,famine,Rogersville MO,savagenation reminds me when the peasants destroyed their food when stalins army came to redistribute the wealth it caused faminedeath,1
5099,famine,Tampa,update 1russian food crematoria provoke outrage amid crisis famine memories russian society still recal,1
5102,famine,Ukraine,food crematoria in russia provoke outrage amid crisis famine memories,1
5106,famine,Telangana,maratha raiders scorched their lands amp punjab refused them food aid during the 1943 famine wonder if bengalis harbor some hard feelings,1
5107,famine,Chatham IL,images of famine hope in christ a blog on what happens when we forget god,1
5110,famine,Charter Member of the VRWC,russian food crematoria provoke outrage amid crisis famine memories yahoo news,1
5114,fatal,Wood Buffalo Alberta,roger goodells fatal mistake tom brady an innocent man,0
5115,fatal,T 1061481786848072612195582811791382,boy 11 charged with manslaughter in shooting death of elijah walker the 11yearold appeared wednesday in a,1
5117,fatal,Anchorage AK,apd investigating fatal shooting of 3 year old child in southeast anchorage,1
5119,fatal,Nakhon Si Thammarat,investigators shift focus to cause of fatal waimate fire,1
5120,fatal,Somewhere with Clyde,asianshawtyy im sorry but im out,0
5122,fatal,Buffalo NY,police man in his early 30s dies after shooting on vermont st,1
5124,fatal,Quincy,man accused in fatal hitandrun to get new judge,0
5125,fatal,Winnipeg,winnipeg police seek witnesses in arlington and william fatal crash,1
5126,fatal,Fresno CA,chrisdanielshow nearlyfatal pee in san francisco,0
5128,fatal,Laredo TX,petition to remaster fatal frame 1 with a windwakerstyle selfie mode,0
5131,fatal,New South Wales Australia,man charged over fatal crash near dubbo refused bail,1
5134,fatal,Poconos,the five fatal flaws in the iran deal,0
5135,fatal,Sacramento,stockton police are investigating a fatal driveby shooting in north stockton,1
5136,fatal,Haddonfield NJ,deputies dog dispute leads to fatal shooting in person county,1
5138,fatal,Southern California,ca cops illegal immigrant with 4 prior arrests charged in fatal sex attack,1
5141,fatal,Jaipur Rajasthan India,success is not permanent amp failure is not fatal,0
5148,fatal,Also follow,boy 11 charged with manslaughter in shooting death of elijah walker,1
5150,fatal,Play For Ryan,fatal attraction,0
5155,fatal,In the potters hands,boy 11 charged in fatal shooting of 3yearold,1
5164,fatalities,New York,nyc news legionnaires death toll rises to 8 in new york city all eight fatalities were of older adults with,1
5165,fatalities,New York,lets fraction the vital need for our fatalities how would you break it down in education econom,0
5168,fatalities,Corpus Christi Texas,we are totally unprepared for an emp attack both china russia and probably isis possess them 90 fatalities why are we pushing them,1
5169,fatalities,Cape Town,city implores motorists not to speed after more reports of animal fatalities near nature reservesgt,1
5171,fatalities,WolverhamptonBrumJersey,understand that there are no fatalities as no one was trapped inside the wholesale market 8 fire engines and 40 fire fighters on scene,1
5172,fatalities,Chamblee Georgia,as of the 6month mark there were a total of 662 fatalities 114 more than the first half of last year,1
5174,fatalities,Official Website,hse releases annual workplace facilities data have a look,0
5175,fatalities,Seattle,seattles deadliest red light runner intersections revealed,1
5176,fatalities,TechFish,5 rejected mortal kombat fatalities mortal kombat has stretched the boundaries of its,0
5177,fatalities,Washington DC Charlotte NC,unsuckdcmetro minor train leaves rails major 11382 smithsonian interlocking derails amp crashes into barrier wall w fatalities,1
5179,fatalities,United States where its warm,,0
5181,fatalities,Washington,saudi arabia abha fatalities reported following suicide bombing at mosque avoid area,1
5182,fatalities,Hope Road Jamaica,use our roads wisely and prevent the carnage from continuinglet us have no fatalities over this holiday periodggindependencmessage,0
5183,fatalities,jersey,mortal kombat fatalities are so gross but interesting,0
5185,fatalities,WestEnd Puritan Ave,dwilliams313 rt ieansquad when you dont know how to do fatalities in mortal kombat,0
5187,fatalities,Youngstown OH,osp concerned about mounting fatalities,1
5189,fatalities,Nantes France,estimated damage and fatalities of an hiroshimasized atomic bomb dropped on your hometown,1
5190,fatalities,St Johns NL Canada,the rcmp are reporting fatalities and serious injuries as a result of the collision on the tch near whitbourne,1
5191,fatalities,Caserta,govt allocating 13 bn for flood action issue takes centre stage after fatalities in veneto,1
5192,fatalities,PekanbaruBatam IslandMedan,there have been zero spider biterelated fatalities in australia since 1979,0
5193,fatalities,oman muscat al seeb,i liked a youtube video,1
5194,fatalities,San Francisco,motordom lobbied to change our language around traffic fatalities we need to go back to the future visionzero,0
5195,fatalities,Wisconsin,sharing to help our cousins family,0
5197,fatalities,Jogja Indonesia Slowly Asia,mortal kombat x is an excellent fatalities and the most fun ive ever had with a mortal kombat segas version,0
5198,fatalities,Vancouver BC,uber reduces drunk driving fatalities says independent study,0
5200,fatalities,USA,las vegas in top 5 cities for redlight running fatalities,1
5202,fatalities,Avon OH,american casualties including 400000800000 fatalities and five to ten million japanese fatalities,1
5204,fatalities,The North,i fail to see how that would not bring the number of road fatalities down immensely,0
5206,fatalities,Philadelphia PA,policylab is at cecanfs last public hearing in nyc today and tomorrow to address child abuse and neglect fatalities,1
5207,fatalities,Just Happy to Be Anywhere,kurtschlichter yep considering that millions of japanese fatalities were projected for downfall freemarketeer dibang,1
5209,fatalities,Lima Ohio,message boards will display updated traffic fatalities up from 582 and new message beginning today traffic deaths 616 slow for workers,1
5210,fatalities,Ireland,driver fatalities down on irish roads but pedestrians and cyclists at more risk,1
5211,fatality,Lowell MA,ebrointheam jaybig lpunbiggiewrap overzero questionfatalityflawless victory,0
5212,fatality,playing soccer eating pizza,jakeadavis fatalityus we are cuddling right now so,0
5218,fatality,New York,so these savages leaked thomas brady gangstermail account and wonder why he was quick to fatality his samsung mobile b real son,0
5219,fatality,Hueco Mundo,i liked a youtube video from vgbootcamp,0
5221,fatality,Nairobi,fatality,0
5222,fatality,Boston Cape Cod,dying of lyme disease case fatality rate nearly 100,1
5224,fatality,Rafael castillo,fatality,0
5227,fatality,New Jersey,tellyfckngo jaycootchi nah you hit homie wit the fatality and then sond him wit the babality cold cold as fuck lmfaoooo,0
5228,fatality,Fort Wayne IN,kosciusko police investigating pedestrian fatality hit by a train thursday,1
5229,fatality,Enterprise NV,fatality,0
5232,fatality,434,they are making a bad boys 3 and 4 a must see,0
5233,fatality,Grand Rapids MI,fatalityus need a team we need one,0
5234,fatality,USA,afghan soldier kills us general americas highestranking fatality since vietnam,1
5235,fatality,434,that usually never happens,0
5236,fatality,New York,babybackreeve fatality,0
5238,fatality,Utica NY,08315 cat fatality utica ny pleasant amp holland aveblack cat with white paws average size on grass next to north side of road,0
5244,fatality,Nunya,seeing that theres a video of every fatality on mileena makes me sad,0
5245,fatality,Houston,chrisman528 fatality,0
5247,fatality,USA,kosciusko police investigating pedestrian fatality hit by a train thursday,0
5249,fatality,TX,fatality scary af probably not the best falcon but still scary,0
5251,fatality,ChristianaTennessee,i liked a youtube video from vgbootcamp,0
5252,fatality,Nashville,truck crash on 40w at us70 in lebanon is a fatality very sad expect long delays through the morning,1
5254,fatality,Bishops Stortford England,lindasocvat tflbusalerts yes apparently report of cow fatality as well sadly,1
5255,fatality,Worldwide,i liked a youtube video from deathmule,0
5256,fatality,Brentwood NY,i added a video to a youtube playlist,0
5259,fatality,Honduras,fatality,0
5262,fear,ChippenhamBath UK,fear factory in december done deal,0
5264,fear,Yewa zone,the meaning i picked the one that changed my life overcome fear behold wondertcc catch the light endless,0
5265,fear,sitting on the fence New York,phnotf sometimes your cheekiness bleeds through my computer screen and i recoil in fear,0
5269,fear,Carregado,i didnt want to hurt you but the fear drove me to do it midnight,0
5270,fear,Largo MD,men fear the feeling of being controlled by a woman or passive aggressively being coerced into commitment before theyre ready,0
5272,fear,mexico,fear factory cars official musicvideo,0
5273,fear,Cape Town Khayelitsha,luzukokoti its all about understanding umntu wakho if you do and trust your partner then y ok u will know and wont fear to do anything,0
5274,fear,Florida,photo referencereference xekstrin i thought the nostrils were eyes and i almost cried from fear partake,0
5276,fear,Indiana,baileysmsteach the fear of not looking like you know what you are doingahhhthat was a big one for me perrychat,0
5281,fear,Stanford University,help me win by having the most shares on my article a lifetime of fear,0
5282,fear,Midwestern USA,cowgirllawyer we must refuse to become a nation with everyone living in fear of being shot unawares by intoxicated ampor crazy people,1
5283,fear,Bedford IN,horror films are made by incredibly creative artists we interviewed 21 of them in depth for the anatomy of fear,1
5285,fear,Thibodaux LA,my worst fear,0
5287,fear,Brazil,when the world say finish god says dont fear,0
5290,fear,In the moment,by replacing fear of the unknown with curiosity we open ourselves up to,0
5293,fear,Alliston Ontario,scottdpierce billharristv harrisgle beezersun im forfeiting this years fantasy football pool out of fear i may win n get my ass kicked,0
5296,fear,SaudI arabia riyadh,live a balanced life balance your fear of allah with hope in his mercy and love for him,0
5297,fear,New York,my biggest fear is that eventually you will see me the way i see myself,0
5298,fear,Athens Nicosia,couples having less sex for fear itll be a let down internet movies and books saying how sex ought to be p,0
5300,fear,Southern California,untangle yourself from requiring your partner to fill your needs and how to love without fear besttalkradio listen,0
5301,fear,Bremerton WA,the walking dead spin off fear the walking dead is on the 23rd,1
5302,fear,Tulalip Washington,mcnabbychic i fear not for a while,0
5304,fear,Indonesia,the fear of the lord is the start of knowledge but the foolish have no use for wisdom and teaching amsal 17,0
5305,fear,Halifax,the number of people denying climate change on the polar bear article makes me fear for the future of the us but also humanity in general,0
5306,fear,Hilton Head SC,sensanders gd ideas im 77 wrked hard now have almost nothing fear lives with poorfran reed 8437150124,0
5308,fear,New York,never let fear get in the way of achieving your dreams deltachildren instaquote quoteoftheday disney waltdisney,0
5309,fear,St Louis MO,fear is my motivator,0
5310,fear,USA,daily reflectionsaugust 6drivendriven by a hundred forms of fear selfdelusion selfseeking and selfpity,0
5315,fire,So Paulo,marquei como visto game of thrones 3x5 kissed by fire,0
5319,fire,2 high 2 come down,misshomasttopa cause were on fire we are on fire were on fire now yeah were on fire we are on fire were on fire nowwwwww,1
5321,fire,Wrex,,0
5323,fire,big boy 0802,im crying that song just ended setting myself on fire,0
5328,fire,Brooklyn,but put flood of fire at the top of the list,1
5330,fire,Canada,im on fire,0
5331,fire,To The Right of You,politifiact harry reids 30 percent of women served planned parenthood claim is a pants on fire lie,0
5332,fire,StCloud MN,dear canonusaimaging i brought it canonbringit fire canontattoo mn theresmorewherethatcamefrom,0
5337,fire,on a catwalk somewhere,fire meet gasoline always gotta get played twice lol,0
5339,fire,Zac Newsome loves me,well it feels like im on fire,0
5341,fire,louisville kentucky,her eyes and words are so icy but she burns like rum on the fire,0
5344,fire,Makai,daughterofnai tenshi activated yukis fire card,0
5345,fire,Fort ValleyGAFayettevilleAR,california been shakingcatching on fireand overcharging ppl on rent for the past 150 years it aint going nowhere,1
5346,fire,Arizona,theres a fire in the catalinas looks kinda cool this picture doesnt do it justice,1
5349,fire,Vancouver BC,justinling i promise not to tax pancakes or rainbows or not dying in a fire,0
5350,fire,Newark NJ,this nigga cyhi diss was what meek was suppose to do this shit actually fire,0
5351,fire,the road to success,i wanna set some shit on fire,1
5352,fire,The Desert,in the words of charlie daniels fire on the mountain run boys run,1
5353,fire,Sydney,i just checked in at on fire on zomatoaus lovefood,1
5354,fire,Yuba City CA,when your heart is bigger than the obstacles in front of you euro dontexpectnothing july fire euro,0
5356,fire,University of South Florida,it may seem like our fire has been a little burnt out,0
5359,fire,the moon,will be dropping fire selfie tomorrow saying youre welcome ahead of time,0
5362,fire%20truck,Niagara Falls Ontario,fire call brant av drummond rd for fire structure single units car 6 on call truck,1
5365,fire%20truck,Woodcreek HS Roseville CA,your psa for the day if a fire truck is behind you with lights going move over so they can get to their call,0
5366,fire%20truck,USA,rfp fire truck service body for f450 fire fighting rescue amp safety equipment transporta,0
5371,fire%20truck,Here There,an 18wheeler came along and struck the fire truck spinning it around 180 degrees and causing it to roll over,1
5372,fire%20truck,District 12 Orange County,sigalert update 3n133 closed at 5 fwy ufn trash truck fire,1
5373,fire%20truck,Plain O Texas,brooktekle didnt look like a murder scene just 1 cops a fire truck and 2 fire assistance cars along with a helicopter,1
5375,fire%20truck,SouthEast Asia,former township fire truck being used in philippines langley times,1
5381,fire%20truck,Saipan CNMI,fire truck and ambulance in k3 phase 3 hope everyones okay prayforsaipan,1
5382,fire%20truck,Orange County Calif,sigalert north amp southbound 133 closed btwn 5 fwy and irvine blvd due to truck fire chp is detouring traffic,1
5383,fire%20truck,lost in my thoughts,eeenice221 true because of the truck that caught fire,1
5385,fire%20truck,Five down from the Coffeeshop,came across this fire video not mineenjoybabes way of saying hi to me while hes in the fire truckfireman,0
5386,fire%20truck,Los Angeles,133 n past the 5 l lane is reopened all other lanes are closed all lanes are open on the 133 s trash truck fire cleanup knx1070,1
5389,fire%20truck,Five down from the Coffeeshop,found this cool photo not mine 1952 dodge wayne bodied 4 window bus ex libby mt fire department truck all ori,1
5392,fire%20truck,Tallahassee FL,toddler bedding firetruck bundle fire truck firefighter sticker decals sign wall,0
5397,fire%20truck,Laguna Beach Calif,truck fire clogs canyon road,1
5400,fire%20truck,Nevada Carson CityFreeman St,rgj truck trailer catches fire in reno,1
5404,fire%20truck,LA,theres a fire truck in this parking lot,0
5410,fire%20truck,Aracaju Sergipe,njturnpike njturnpike reopens hours after truck fire in,1
5412,first%20responders,Nashville Tennessee,im grateful for our first responders mnpdnashville nashvillefd and others who acted so swiftly to save countless lives today,1
5413,first%20responders,Texas,usatoday praying for gods healing and safety of first responders,0
5416,first%20responders,Long Eaton Derbyshire UK,join charity 10k run event doningtondash11am start sun 20 sept 2015castle donington community first responders,0
5417,first%20responders,WorldWide,loved the way this book was written to include so many vantage points of first responders detkenlang kindle,0
5420,first%20responders,Portage IN Worldwide,we can help says denver firefighter working to curb first responder suicide,1
5423,first%20responders,Victoria,whats cool is that teens are becoming what i like to call digital first responders for their friends who need a little help or support,0
5426,first%20responders,RoadsTrails Everywhere,rt roadid thanks to alex for his story amp to all first responders for being there when we need you,0
5428,first%20responders,New York,i just added sandy first responders lost their homes to vip home page group on vimeo,1
5430,first%20responders,Nashville,thankful for our first responders especially mnpdnashville for life saving response today in antioch,1
5437,first%20responders,Liberty Township Ohio,reds i dont throw the word hero around lightly usually reserved for first responders and military but hes a hero,0
5439,first%20responders,Aberdeenshire,us wants future first responders to be more hightech,0
5442,first%20responders,Los Angeles,theres still room for you at our party for first responders from around the country 3rd annual best ever,0
5443,first%20responders,A Hoop Somewhere,incase of accident the first responders would know that there is a baby present,0
5444,first%20responders,Michigan,kirsten gillibrand,1
5445,first%20responders,Bloomington Indiana,we can help says denver firefighter working to curb first responder suicide,1
5446,first%20responders,USA,first responders convene for national summit and awards on gis technology,0
5449,first%20responders,Washington,some good info to help first responders cope individual resilience factsheet for responders,0
5452,first%20responders,Basking Ridge NJ,first responders get int bridgeportspeed free on saturday details,0
5454,first%20responders,Stalybridge Tameside,at the 999day emergency services display meeting the brave police firefighters and first responders that help keep us safe,1
5458,first%20responders,Sacramento,as firefighters make gains on rockyfire jerry brown is heading to the area to meet with first responders tomorrow morning,1
5459,first%20responders,Franklin TN near Nashville,after shooting event at the theater starbucks is giving free coffee to all first responders police amp firefighters antiochhickoryhollowtn,1
5460,first%20responders,St Louis Missouri,no lender fees for veterans or first responders past and present on linkedin,0
5461,flames,Bandung,new giant flames giant full black pantofel infoorder sms087809233445 pin23928835,1
5462,flames,New York,new snap on tools black baseball hatcap silvergray embroidered s logo flames full re,0
5465,flames,New York,new snap on tools black baseball hatcap silvergray embroidered s logo flames full re,0
5466,flames,Louisville KY,vampiro going through the table of flames ultimalucha luchaunderground elreynetwork,0
5468,flames,Manhattan,if you cant summon the flames directly from hell store bought is fineme momdies,0
5469,flames,Freeport Ny,just added some more fire to the flames for saturday rick wonder will be spinning a guest set along with chachi,0
5471,flames,650559,kelworldpeace taxstone yoga flames,0
5475,flames,dreamy lake,i guess you can say igs hopes went up in flames,0
5477,flames,houstn,that new lil b x chance is nothing but flames,0
5479,flames,hell,gilderoy i wish i was good enough to add flames to my nails im on fire,1
5480,flames,Asheville NC,my gang walking round with them brown flames amp thats 100nd,0
5481,flames,New York,new snap on tools black baseball hatcap silvergray embroidered s logo flames full re,0
5482,flames,St Patricks Purgatory,tadhgtgmtel dude was just smoking and the fucking thing went up in flames i though a bomb went off omg scared,1
5485,flames,cockerelshoes,new giant flames giant manly brown infoorder sms087809233445 pin2327564d,0
5486,flames,USA,you see the devastation amp its shocking firefighters continue to battle flames in california benstracy reports,1
5487,flames,manaus,watching it go up in flames,1
5488,flames,Sioux Falls SD,rp said they can see smoke coming from the silo on 260th street in hartford but no flames,1
5491,flames,Republica Dominicana,maryland mansion fire that killed 6 caused by damaged plug under christmas tree report says into the flames firefighters bravery,1
5492,flames,Eastlake OH,erinmariefishy everyone is setting flames upon me,0
5493,flames,HillsvilleLynchburg VA,flamesnation thats the optimistic side of me no doubt its tough but it can be done i feel like the games will pivot on defense,0
5494,flames,USA,maryland mansion fire that killed 6 caused by damaged plug under christmas tree report says into the flames,1
5495,flames,Some where,so pardon me while i burst into flames ive had enough of the world and its peoples mindless games,0
5496,flames,Travelling around the world,awickedassassin want to burst into flames anna hugged him tightly,0
5497,flames,616 Kentwood MI,selmoooooo edvinnn imtariik dzaficharis selmo u not catching flames from me im just gonna be witnessing the slaughter,1
5501,flames,Jet Life,i have a rising follower graph 2 more followers in the past week get your stats right here,0
5502,flames,Fairy Tail,aisumage akumareisu just between gray and ophelia red flames blazing around her person setting nearly everything in the area,1
5503,flames,Santo Domingo Alma Rosa,soloquiero maryland mansion fire that killed 6 caused by damaged plug under christmas tree report says into the flames firefighte,1
5505,flames,Somewhere Around You,maryland mansion fire that killed 6 caused by damaged plug under christmas tree report says into the flames,1
5506,flames,Houston Corsicana,cwhoops you better make all your shots tomorrow cause im recording and flames will be thrown tomorrow,0
5507,flames,Cincinnati OH,i added a video to a youtube playlist,0
5509,flames,Bacon,he better than sean bro i can admit that sean is flames now but he better than sean,0
5514,flattened,Some other mansion,flattened all cartoonylikewhoa there papa,0
5515,flattened,Chicago,the road to success is paved with pennies that i flattened on the train tracks youre welcome,0
5517,flattened,Astley Manchester,feel like ive been flattened by a sumo wrestler no pain no gain muaytai wantmyabsback strong,0
5518,flattened,Bow NH,ideas in food flattened,0
5519,flattened,Leicester,zouma has just flattened him there cfc,0
5520,flattened,Frome Somerset England,zouma has just absolutely flattened that guy,0
5521,flattened,Mars,flattened,0
5522,flattened,Melbourne Victoria,70 years ago the first atomic attack flattened hiroshima 3 days later it was nagasaki both war crimes to put moscow in its place,1
5524,flattened,UK,today august 6th is the 70th anniversary of abomb little boy been dropped on hiroshima70000 killed outright as the city was flattened,1
5525,flattened,Essex England,would have just flattened the little midget,0
5526,flattened,New York,who said this yosemite sam or drumpf nobody ill vote for a flattened out rabbit skin ahuh huh i always say,0
5528,flattened,somewhere too cold for me,grabakahitman izigarcia when he flattened machidadid he lose that fightnope he lost fights to guys he shouldnt of lost to also,1
