id,keyword,location,text,target
48,ablaze,Birmingham,bbcmtd wholesale markets ablaze,1
49,ablaze,Est September 2012 Bristol,we always try to bring the heavy metal rt,0
50,ablaze,AFRICA,africanbaze breaking newsnigeria flag set ablaze in aba,1
52,ablaze,Philadelphia PA,crying out for more set me ablaze,0
53,ablaze,London,on plus side look at the sky last night it was ablaze,0
54,ablaze,Pretoria,phdsquares mufc theyve built so much hype around new acquisitions but i doubt they will set the epl ablaze this season,0
55,ablaze,World Wide,inec office in abia set ablaze,1
57,ablaze,Paranaque City,ablaze for you lord d,0
59,ablaze,Live On Webcam,check these out,0
62,ablaze,milky way,had an awesome time visiting the cfc head office the ancop site and ablaze thanks to tita vida for taking care of us,0
66,ablaze,GREENSBORONORTH CAROLINA,how the west was burned thousands of wildfires ablaze in california alone,1
71,ablaze,UK,first night with retainers in its quite weird better get used to it i have to wear them every single night for the next year at least,0
73,ablaze,Sheffield Township Ohio,deputies man shot before brighton home set ablaze,1
74,ablaze,India,man wife get six years jail for setting ablaze niece,1
76,ablaze,Barbados,santa cruz head of the st elizabeth police superintendent lanford salmon has r,0
77,ablaze,Anaheim,police arsonist deliberately set black church in north carolinaablaze,1
78,ablaze,Abuja,noches elbestia alexissanchez happy to see my teammates and training hard goodnight gunners,0
79,ablaze,USA,kurds trampling on turkmen flag later set it ablaze while others vandalized offices of turkmen front in diyala,1
80,ablaze,South Africa,truck ablaze r21 voortrekker ave outside or tambo intl cargo section,1
81,ablaze,Sao Paulo Brazil,set our hearts ablaze and every city was a gift and every skyline was like a kiss upon the lips,0
82,ablaze,hollywoodland,they sky was ablaze tonight in los angeles im expecting ig and fb to be filled with sunset shots if i know my peeps,0
83,ablaze,Edmonton Alberta Treaty 6,how the west was burned thousands of wildfires ablaze in california alone,1
86,ablaze,Inang Pamantasan,progressive greetingsin about a month students would have set their pens ablaze in the torch publications,0
89,ablaze,Twitter Lockout in progress,rene ablaze amp jacinta secret 2k13 fallen skies edit mar 30 2013,0
91,ablaze,Concord CA,navista7 steve these fires out here are something else california is a tinderbox and this clown was setting my hood ablaze news24680,1
92,ablaze,Calgary AB,nowplaying rene ablaze amp ian buff magnitude,0
93,ablaze,Birmingham,nxwestmidlands huge fire at wholesale markets ablaze,1
95,ablaze,San Francisco,ablaze what time does your talk go until i dont know if i can make it due to work,0
96,accident,CLVLND,i cant have kids cuz i got in a bicycle accident amp split my testicles its impossible for me to have kids michael you are the father,0
97,accident,Nashville,accident on i24 w nashvilletraffic traffic moving 8m slower than usual,1
98,accident,Santa Clara CA,accident center lane blocked in santaclara on us101 nb before great america pkwy bayarea traffic,1
100,accident,UK,,0
102,accident,St Louis MO,stlouis caraccidentlawyer speeding among top causes of teen accidents,0
104,accident,Walker County Alabama,reported motor vehicle accident in curry on herman rd near stephenson involving an overturned vehicle please use,1
105,accident,Australia,bigrigradio live accident awareness,1
107,accident,North Carolina,i77 mile marker 31 south mooresville iredell vehicle accident ramp closed at 86 118 pm,1
110,accident,Norf Carolina,by accident they knew what was gon happen,0
112,accident,San Mateo County CA,traffic accident n cabrillo hwymagellan av mir 080615 110358,1
113,accident,North Carolina,i77 mile marker 31 to 40 south mooresville iredell vehicle accident congestion at 86 118 pm,1
114,accident,Njoro Kenya,the pastor was not in the scene of the accidentwho was the owner of the range rover,1
118,accident,Your Sisters Bedroom,i was in a horrible car accident this past sunday im finally able to get around thank you god,1
120,accident,Arlington,truckcrash overturns on fortworth interstate,1
121,accident,South Bloomfield OH,accident in ashville on us 23 sb before sr 752 traffic,1
128,accident,New Hanover County NC,fyi cadfyi accident property damagenhs999 piner rdhorndale dr,1
129,accident,Maldives,rt naayf first accident in years turning onto chandanee magu from near mma taxi rammed into me while i was halfway turned everyone conf,1
130,accident,Manchester NH,accident left lane blocked in manchester on rt 293 nb before eddy rd stop and go traffic back to nh3a delay of 4 mins traffic,1
131,accident,Wilmington NC,accident property damage piner rdhorndale dr,1
133,accident,New Hanover County NC,fyi cadfyi accident property damagewpd1600 s 17th st,1
135,accident,global,aashiqui actress anu aggarwal on her nearfatal accident,1
136,accident,Alberta Sask Montana,suffield alberta accident,1
137,accident,Charlotte,9 mile backup on i77 southaccident blocking the right 2 lanes at exit 31 langtree rdconsider nc 115 or nc 150 to nc 16 as alternate,1
138,accident,Baton Rouge LA,has an accident changed your life we will help you determine options that can financially support life care plans and ongoing treatment,0
139,accident,Hagerstown MD,breaking there was a deadly motorcycle car accident that happened to hagerstown today ill have more details at 5 your4state whag,1
141,accident,Gloucestershire UK,flowri were you marinading it or was it an accident,0
144,accident,UK,norwaymfa bahrain police had previously died in a road accident they were not killed by explosion,1
145,accident,Nairobi Kenya,i still have not heard church leaders of kenya coming forward to comment on the accident issue and disciplinary measuresarrestpastornganga,0
146,aftershock,Instagram heyimginog,aftershockdelo scuf ps live and the game cya,0
149,aftershock,304,the man who can drive himself further once the effort gets painful is the man who will win roger bannister,0
151,aftershock,Switzerland,320 ir icemoon aftershock,0
153,aftershock,304,there is no victory at bargain basement prices dwight david eisenhower,0
156,aftershock,USA,320 ir icemoon aftershock,0
157,aftershock,304,nobody remembers who came in second charles schulz,0
158,aftershock,Instagram heyimginog,aftershockdelo im speaking from someone that is using a scuf on xb1 most of them people will end up getting on for ps also,0
159,aftershock,304,the harder the conflict the more glorious the triumph thomas paine,0
161,aftershock,Somewhere Only We Know,so i guess no one actually wants any free aftershock tc,0
163,aftershock,Belgium,aftershock,0
164,aftershock,Switzerland,320 ir icemoon aftershock,0
170,aftershock,dope show,kjfordays im seeing them and issues at aftershock,0
171,aftershock,Switzerland,320 ir icemoon aftershock,0
173,aftershock,Oshawa Canada,wisdomwed bonus 5 minute daily habits that could really improve your life how many do you already do lifehacks,0
174,aftershock,Baker City Oregon,aftershock protect yourself and profit in the next global financial meltdown by david wiedemer http,0
178,aftershock,USA,gtgt 15 aftershock protect yourself and profit in the next global financial book esquireattire,0
180,aftershock,304,sometimes you face difficulties not because youre doing something wrong but because youre doing something right joel osteen,0
182,aftershock,304,the only thing that stands between you and your dream is the will to try and the belief that it is actually possible joel brown,0
183,aftershock,marysville ca,praise god that we have ministry that tells it like it is now wdyouth biblestudy,0
184,aftershock,304,remembering that you are going to die is the best way i know to avoid the trap of thinking you have something to lose steve jobs,0
185,aftershock,Hermosa Beach CA,tried orange aftershock today my life will never be the same,0
193,aftershock,304,people who say it cannot be done should not interrupt those who are doing it george bernard shaw,0
194,aftershock,304,the first man gets the oyster the second man gets the shell andrew carnegie,0
196,airplane%20accident,19600858 99047821,experts in france begin examining airplane debris found on reunion island french air accident experts o,1
197,airplane%20accident,Pennsylvania,strict liability in the context of an airplane accident pilot error is a common component of most aviation cr,1
198,airplane%20accident,Salt Lake City Utah,crobscarla your lifetime odds of dying from an airplane accident are 1 in 8015,0
199,airplane%20accident,Palo Alto CA,experts in france begin examining airplane debris found on reunion island french air accident experts on wedn,1
203,airplane%20accident,Spain but OpaLocka FL,family members of osama bin laden have died in an airplane accident how ironic mhmmm gov shit i suspect,1
204,airplane%20accident,Jaipur India,man goes into airplane engine accident,1
205,airplane%20accident,Hyderabad Telangana INDIA,horrible accident man died in wings of airplane 29072015,1
208,airplane%20accident,Eagle Pass Texas,a cessna airplane accident in ocampo coahuila mexico on july 29 2015 killed four men including a state of coahuila government official,1
209,airplane%20accident,bangalore,horrible accident man died in wings airplane 29072015 watchthevideo,1
210,airplane%20accident,Financial News and Views,experts in france begin examining airplane debris found on reunion island,1
212,airplane%20accident,Indonesia,kca votejkt48id mbataweel rip binladen family members who killed in an airplanes accident,1
213,airplane%20accident,your boyfriends legs,i almost sent my coworker nudes on accident thank god for airplane mode,0
215,airplane%20accident,New Mexico USA,mickinyman theatlantic that or they might be killed in an airplane accident in the night a car wreck politics at its best,0
216,airplane%20accident,Somewhere Out There,experts in france begin examining airplane debris found on reunion island french air accident experts on,1
219,airplane%20accident,Mumbai,horrible accident man died in wings of airplane29072015,1
220,airplane%20accident,sri lanka,horrible accident man died in wings of airplane 29072015,1
221,airplane%20accident,Not a US resident,usama bin ladins family dead in airplane crash naturally no accident,1
225,airplane%20accident,Lehigh Valley PA,strict liability in the context of an airplane accident,1
226,airplane%20accident,Canada,dtn brazil experts in france begin examining airplane debris found on reunion island french air accident exp,1
231,airplane%20accident,Thrissur,horrible accident man died in wings of airplane 29072015 wtf you cant believe your eyes,1
232,airplane%20accident,Havenford,nicole fletcher one of a victim of crashed airplane few times ago the accident left a little bit trauma for her although shes,1
235,airplane%20accident,India,omg horrible accident man died in wings of airplane,1
237,airplane%20accident,92,omg i dont believe this rip broairplane accident jetengine turbojet boing g90,1
240,airplane%20accident,Israel,i had a airplane accident,1
241,airplane%20accident,Fashion Heaven IG TMId,my phone looks like it was in a car ship airplane accident terrible,0
242,airplane%20accident,San Francisco,statistically im at more of risk of getting killed by a cop than i am of dying in an airplane accident,0
243,airplane%20accident,Italy,airplane crashes on house in colombia 12 people die in accident,1
244,airplane%20accident,New York,the shooting or the airplane accident,1
245,airplane%20accident,Toronto,could a drone cause an airplane accident pilots worried about use of drones esp in close vicinity of airports,1
247,ambulance,Jackson,,1
248,ambulance,New York,two air ambulances on scene of serious crash between two cars and lorry in,1
251,ambulance,New Orleans LA,leading emergency services boss welcomes new ambulance charity,0
252,ambulance,West Wales,anyone travelling aberystwythshrewsbury right now theres been an incident services at a halt just outside shrews ambulance on scene,1
254,ambulance,Happily Married with 2 kids,ambulance sprinter automatic frontline vehicle choice of 14 lez compliant ebay,0
256,ambulance,Cambridge MA,new nanotech device will be able to target and destroy blood clots,0
258,ambulance,Arizona,20skyhawkmm20 traplord29 fredosantana300 lilreese300 it was hella crazy 3 fights an ambulance and a couple mosh pits,1
260,ambulance,Mumbai,if i get run over by an ambulance am i lucky justsaying randomthought,0
262,ambulance,Amsterdam,,1
263,ambulance,SwindonEngland,tanslash waiting for an ambulance,0
265,ambulance,Happily Married with 2 kids,ambulance sprinter automatic frontline vehicle choice of 14 lez compliant ebay,0
267,ambulance,Williamstown VT,thenissonian rejectdcartoons nissan are you ok do you need medical assistance i can call an ambulance if you need me to,0
268,ambulance,North Carolina USA,ems1 ny emts petition for 17 per hour minimum wage,0
270,ambulance,Karachi,twelve feared killed in pakistani air ambulance helicopter crash,1
271,ambulance,Happily Married with 2 kids,ambulance sprinter automatic frontline vehicle choice of 14 lez compliant ebay,0
272,ambulance,Happily Married with 2 kids,ambulance sprinter automatic frontline vehicle choice of 14 lez compliant ebay,0
273,ambulance,Loveland Colorado,kiwikaryn check out whats in my parking lot he said that until last year it was an ambulance in st johns,0
274,ambulance,c h i c a g o,when you dont know which way an ambulance is coming from ltlt,1
277,ambulance,L A,,1
280,ambulance,Canada,leoblakecarter this dog thinks hes an ambulance,0
281,ambulance,VISIT MY YOUTUBE CHANNEL,happening now hatzolah ems ambulance responding with dual sirens and,0
283,ambulance,Lexington,,1
287,ambulance,USA,twelve feared killed in pakistani air ambulance helicopter crash,1
289,ambulance,Hannover Germany,twelve feared killed in pakistani air ambulance helicopter crash,1
293,ambulance,Playa,,1
294,ambulance,Davidson NC,people who try to jwalk while an ambulance is passing i hate you,0
296,annihilated,Higher Places,the episode where trunks annihilated freiza is the cleanest shit ever he showed that nigga no mercy,0
297,annihilated,Horsemind MI,they shall be annihilated and all of their petebests dessicated and laid bare then you shall kneel before me,0
298,annihilated,New York,uribe just annihilated that baseball mets,0
299,annihilated,Boksburg,marksmaponyane heysundowns were annihilated in their previous meeting with celticindeed its an improvement,0
307,annihilated,VRP OZRP MV AU R18,to luka they should all die all of them everything annihilated alois trancy,0
309,annihilated,Greater Manchester UK,acarewornheart have a good un fella sorry i wont be there to get annihilated with you,0
310,annihilated,Boston,cop pulls drunk driver to safety seconds before his car is hit by train,1
314,annihilated,The Canopy Kingdom,boom your country was just entirely annihilated by a h britain,0
316,annihilated,USA,one thing for suregod has promised israel will not be annihilated butthe horror of iran wnukes,0
321,annihilated,the own zone layer,day 1 of tryouts went good minus the fact i stopped quickly to get a short ball and annihilated my toenail injury even more,0
322,annihilated,London,during the 1960s the oryx a symbol of the arabian peninsula were annihilated by hunters,1
327,annihilated,Trancy Manor,to luka they should all die all of them everything annihilated alois trancy,0
329,annihilated,South 37,philipduncan breakfastone people annihilated by last nights weather really philip thought you would have forecast that,1
331,annihilated,West Lancashire UK,stormbeard steellord i seen judas priest in 2005 when rob came back scorpions as support fucking annihilated the place astonishing gig,0
332,annihilated,PA,officially skipping out on fantasticfourfant4sticwhatever the hashtag is its getting annihilated in reviews bummer,0
335,annihilated,Views From The Six,just completely annihilated cech with paul keegan what a time to be alive,0
337,annihilated,University of Toronto,sirbrandonknt exactly thats why the lesnarcena match from summerslam last year was so great because brock annihilated a guy whos,0
340,annihilated,Swaning Around,annihilated in damascus syrian army grinds alloosh and his gang into the manure pile,1
344,annihilated,London,a fun filled happyhour at simmons bar in camden with this handsome one i got annihilated apart from this game,0
345,annihilated,AlbanyNY,juanny beisbol sr annihilated that ball lgm,0
346,annihilation,California,rvfriedmann hell is just a fraction of his belief of total annihilation destruction of usa lodisilverado ritzyjewels,1
352,annihilation,Wild Wild Web,annihilating quarterstaff of annihilation,1
353,annihilation,Subconscious LA,world annihilation vs self transformation,0
354,annihilation,Spain,starmade stardate 3 planetary annihilation,1
356,annihilation,CA physically Boston Strong,us national park services tonto national forest stop the annihilation of the salt river wild horse,1
358,annihilation,Yeezy Taught Me NV,kimkardashian can you please sign and share this petition to save wild horses in arizona,0
361,annihilation,CA physically Boston Strong,theellenshow please check into salt river horses help stop the annihilation about to happen without 54000 more signatureschange org thx,0
363,annihilation,USA,are souls punished withannihilation,0
368,annihilation,Rock Hill SC,i reject the laws of the misguided false prophets imprison nations fueling self annihilation,0
370,annihilation,Coolidge AZ,us national park services tonto national forest stop the annihilation of the salt river wild horse,0
371,annihilation,Republic of Texas,the annihilation of jeb christie amp kasich is less than 24 hours awayplease god allow me at least one more full day,0
380,annihilation,Phoenix AZ,hey az sign this petition to save the wildhorses tantonationalforest a rollingstones singalong is in order,0
381,annihilation,Ljubljana Slovenia,stop the annihilation of the salt river wild horses,1
383,annihilation,Connecticut,sonofbaldwin and hes the current nova in the bookslast i checkedhe was tied into the books in 2011 after rider died during annihilation,0
384,annihilation,TacomaWashington,us national park services tonto national forest stop the annihilation of the salt river wild horse,0
390,annihilation,Subconscious LA,world annihilation vs self transformation,1
393,annihilation,BIG D HOUSTONBOSTONDENVER,us national park services tonto national forest stop the annihilation of the salt river wild horse,0
394,annihilation,Chandler AZ,us national park services tonto national forest stop the annihilation of the salt river wild horse,1
396,apocalypse,ColoRADo,im gonna fight taylor as soon as i get there,0
397,apocalypse,sindria,ohh no fukurodani didnt survive the apocalypse bokuto feels horrible my poor boy my ppor child,1
402,apocalypse,Texas,apocalypse please,0
404,apocalypse,Elk Grove CA USA,another hour its august 05 2015 at 0802pm heres red rover zombie apocalypse 2014,1
406,apocalypse,Texas,honeybunzgem primalkitchen i feel like me doing a pullup is one of the stages of the apocalypse,0
409,apocalypse,The Shire,but if its the apocalypse lol gf m8,0
410,apocalypse,Austin,i know its a question of interpretation but this is a sign of the apocalypse i called it,1
412,apocalypse,Oakland,julie r is the apocalypse version of romeo juliet warmbodies,0
418,apocalypse,Albuquerque,and so it begins day one of the snow apocalypse,1
420,apocalypse,Buenos Aires,candylit imagine sarumi in a zombie apocalypse fighting back to back heart to heart conversations over the,0
424,apocalypse,San Antonioish TX,dad bought a dvd that looks like a science doc on the front but i read the back and its actually about the impending biblical apocalypse,1
426,apocalypse,San Francisco,alexandrapullin it is indeed if the apocalypse comes this week i know where ill be,0
427,apocalypse,Oregon USA,go look at grizzly peak right now it looks like the beginning of an dystopian apocalypse movie,0
429,apocalypse,Harlingen TX,my niece just asked me would you be scared if there was an apocalypse here,0
432,apocalypse,Buffalo NY,theres a storm over cairo in the latest xmen apocalypse set photo,1
438,apocalypse,Las Vegas,i know where to go when the zombies take over,0
444,apocalypse,Tokyo,enjoyed liveaction attack on titan but every time i see posters im reminded how freshly clean and coiffed everyone is in the apocalypse,0
446,armageddon,California,pbban temporary300 avysss armageddon do not kill flags only fast xp for reason,0
447,armageddon,California,pbban temporary300 russaky89 armageddon do not kill flags only fast xp for reason,0
448,armageddon,FLIGHTCITY UK,official vid doublecups gtgt,0
452,armageddon,Alphen aan den Rijn Holland,bed time dont wake me up unless revolution or armageddon start,0
454,armageddon,Wrigley Field,katiekatcubs you already know how this shit goes world series or armageddon,0
456,armageddon,probably the strip club,im gonna beat armageddon as hsu hao just got a flawless on my first try,0
457,armageddon,Canada,enews ben afflecki know theres a wifekids and other girls but i cant help it ive loved him since armageddon eonlinechat,0
459,armageddon,UK,if id have had a long coat to hand id have worn it the certainty of armageddon bears a sense of occasion,0
461,armageddon,USA,your phone is spying on you hidden back door nsa data mining software the financial armageddon blog,0
462,armageddon,California,pbban temporary300 hyiderghost2 armageddon do not kill flags only fast xp for reason,1
465,armageddon,California,pbban temporary300 fighterdena armageddon do not kill flags only fast xp for reason,0
466,armageddon,New York,photo sketch i did based on the a taste of armageddon episode of startrek tos,0
467,armageddon,Here And There,armageddon,1
468,armageddon,Rotterdam ZuidHolland,aberdeenfc aberdeenfanpage good luck to the tomorrow night get some coefficient points plz armageddon,0
469,armageddon,Derry 17,paddytomlinson1 armageddon,0
470,armageddon,Nowhere Everywhere,rohnertparkdps youre another one for the history books thank the justice department and by the way i havent paid income tax in 20yrs,0
471,armageddon,Florida,vladimir putin issues major warning but is it too late to escape armageddon,1
472,armageddon,Worldwide,gods kingdom heavenly govt will rule over all people on the earth after armageddon,0
475,armageddon,Nowhere Everywhere,lets talk some more about your goof guild saunders come right up here on stage,0
476,armageddon,East Coast,karnythia my niece is gaining the ability to stand im getting prepared for toddler apocalypse armageddon,0
477,armageddon,California,check out preppers doomsday must have library collection on cd shtf preppertalk survival 2a prepper,0
478,armageddon,Toronto ON,erker again eep thought of you yesterday when i saw that hella scary hail armageddon,1
480,armageddon,The Orwellion policestate,sadly how windows 10 reveals microsofts ethics armageddon,0
481,armageddon,Castaic CA,armageddon averted by el patronultimalucha,0
482,armageddon,Helsinki Finland,samihonkonen if you have the time 23 hours the latest series about ww1 blueprint for armageddon is extremely impressive,0
483,armageddon,East Kilbride,european fitba till christmas armageddon,0
485,armageddon,FLIGHTCITY UK,official vid gt doublecups gtgt,0
486,armageddon,middle eastern palace,tomorrow is the day we start armageddon preseasonworkouts,0
487,armageddon,Kent,lee does comedy leejasper working class tories prepare for your armageddon interestraterise,0
492,armageddon,Nowhere Everywhere,rohnertparkdps youre on stage now right under the lights isnt it funny where do you get the goofballs with which you staff your pd,0
493,armageddon,FLIGHTCITY UK,official vid thereal gtgtgt,0
495,armageddon,Perthshire,well done celtic fingers crossed for aberdeen tomorrow night armageddon eh,0
504,army,twitchtvnaturalemblem26,seeing that army of whitewalkers was the very first thing that has slightly intrigued me on got so far,0
506,army,cyprus,build your own kingdom and lead your army to victory start g this friend code lzktjnox,0
509,army,Memphis,salvation army hosts rally to reconnect fathers with children the salvation army is hosting a back to school rally,1
513,army,Studio,but if you build an army of 100 dogs and their leader is a lion all dogs will fight like a lion,1
514,army,Hollywood CA,show me a hero tv review,0
517,army,New York,infantry mens lume dial army analog quartz wrist watch sport blue nylon fabric full rea,0
520,army,Pakistan,rt drayesha4 indiakomuntorjawabdoindian army ki,0
521,army,Mexico,5 seconds of summer is my pick for,0
524,army,Campinas Sp,you da one mtvsummerstar videoveranomtv mtvhottest britney spears lana del rey,0
527,army,Harlem New York,stony jackson is americas last hope as he leads an army of felons thus and army rejects against the army o satan,0
528,army,New York,wwi wwii japanese army navy military japan leather watch war mido ww1 2 full read by ebay,0
536,army,Washington,potus appoints brig gen richard g kaiser as member of the mississippi river commission learn more about the mrc,0
538,army,BurbankCA,ap what a violent country get the army involved to help control the killings and bring back peace to the poor people,1
540,army,New York,wwi wwii japanese army navy military japan leather watch war mido ww1 2 full read by ebay,0
550,arson,Spokane Washington,spokane authorities say theyre struggling to solve arson cases like todays on hamilton,1
551,arson,USA,thousands attend a rally organized by peace now protesting the arson attack that took the life of an,1
552,arson,Charlotte,add familia to the arson squad,0
556,arson,Our Empire State,another fake hate crime lesbians burn their own house down what else is new,1
560,arson,Jerusalem,mourning notices for stabbing arson victims stir politics of grief in israel,1
561,arson,Kingston Pennsylvania,the sound of arson,0
