id,keyword,location,text,target
8040,refugees,AmmanJordan,in photos the young refugees forced to flee burundis violence vice news,1
8043,refugees,tripoli international airport,kristindavis un refugees thank you un and refugees for helping so many people in need all over the world,0
8047,refugees,Auckland,,0
8055,refugees,NYCUS Cali Colombia,the most generous bride on earth couple feeds 4000 syrian refugees on their wedding day,0
8057,refugees,QLD Australia,the 46 returned refugees what were they fleeing from amp how will the vietnamese govt treat them now they are returned dutton presser,1
8058,refugees,Geneva Switzerland,chpsre rt refugees for our followers in paris do visit a dream of humanity exhibition by rezaphotography,1
8060,rescue,Trinidad Tobago,policyholders object to clico rescue plan,1
8061,rescue,SF Bay Area,dont panik kelbytomlinson to the rescue,0
8062,rescue,HarleyChickPJNTRunBenRun,coastal german shepherd rescue oc shared a link,0
8064,rescue,Toronto Ontario,ud rescue structural collapse scott road ypres road york 14 trucks,1
8065,rescue,New Jersey,rescue of the day its world cat day saturday aug 8th black blackwhite cats just 5,0
8066,rescue,Big NorthEast Litter Box,im on 2 blood pressure meds and its still probably through the roof long before the ppact story broke i was involved in animal rescue,0
8067,rescue,Sand springs oklahoma,coastal german shepherd rescue oc shared a link,0
8070,rescue,Surry Hills Sydney,any lengths to rescue a cat in need,0
8071,rescue,Sand springs oklahoma,last chance animal rescue has 3 new posts,0
8073,rescue,HarleyChickPJNTRunBenRun,last chance animal rescue has 3 new posts,0
8079,rescue,USA,lunch for the crew is made night night its been a long day peaceloverescue,0
8081,rescue,Thornton Colorado,tell the united nations plantations are not forests,0
8083,rescue,Wanderlust,mary coming to troy rescue,0
8085,rescue,Karachi,floodzone general raheel sharif visits chitral he also lauded the efforts of fwo army troops and army aviation in rescue opera,1
8089,rescue,India,officials rescue 367 migrants off libya 25 bodies found fox news,1
8091,rescue,USA FEMA Region 5,coastal german shepherd rescue oc shared a link,0
8094,rescued,USA,zakbagans this is sabrina my dad rescued her from some dude who kept her in a cage weve had her since i was 4,1
8096,rescued,Nigeria,4 kidnapped ladies rescued by police in enugu nigerian tribune,1
8097,rescued,Jakarta,rescued med migrants arrive in sicily,1
8098,rescued,Ohio USA,tennoatax i hand you a glass of water and sit down i was rescued by a tenno ive lived in my ship around the dojo for about a year,0
8100,rescued,watford,trust us to get rescued by the dopey ones val is hilarious shame shes probably going to die emmerdale,0
8101,rescued,West Hollywood,summer summervibes california puppy pitmix rescued brixton banksy happy mybabies,0
8102,rescued,Kent,man who buried dog alive thought no one would find her but she was rescued just in time,0
8103,rescued,Canada,10monthold baby girl was rescued by coastguard after she floated half a mile out to sea socialnews,1
8105,rescued,The Multiverse,but now skyrim awaits to be rescuedagain,0
8106,rescued,USA,rescued med migrants arrive in sicily,1
8109,rescued,Bournemouth,the finnish hip hop pioneer paleface will be rescued from a drifting raft and brought into the container later enkelbiljett menolippu,0
8110,rescued,Jammu Kashmir Delhi,18 bovines rescued 3 smugglersnabbed,1
8116,rescued,southern california,a brave little dog gets rescued from the river his recovery will inspi,0
8118,rescued,Philadelphia Pennsylvania USA,homeless man traveling across usa with 11 stray dogs he rescued gets a helping hand from strangers,0
8120,rescued,WinstonSalem NC,you can only be rescued from where you actually are and not from where you pretend you are giorgio hiatt,0
8121,rescued,Huntley IL,we rescued my dog at least 9 years ago shes old but still sweet as ever zakbagans,0
8122,rescued,Nigeria,,1
8125,rescued,The green and pleasant land,why werent they taken back to africa once rescued c4news,1
8126,rescued,Worldwide,migrants rescued after boat capsizes off libya,1
8130,rescued,Leeds UK,trust us to get rescued by the dopey ones emmerdale summerfate,0
8131,rescued,Ireland,three beached whales rescued in kerry,1
8136,rescued,Pennsylvania,zakbagans pets r like part of the family i love animals the last 2 pets i had i rescued breaks my heart when animals are mistreated,0
8137,rescued,Boston,i liked a youtube video,0
8138,rescued,Canada,angry mistrustful rescued elephant finds peace and friendship in her new home photos,0
8140,rescued,JakartaKuala LumpurSpore,photo hundreds of rescued migrants await disembarkment from an irish naval vessel at palermo italy tconnellyr,1
8141,rescued,Cape Town,rescued med migrants arrive in sicily,1
8142,rescuers,Nigeria,video were picking up bodies from water rescuers are searching for hundreds of migrants in,1
8143,rescuers,Westerland,video were picking up bodies from water rescuers are searching for hundreds of migrants in the mediterran,1
8144,rescuers,Kuala Lumpur,video were picking up bodies from water rescuers are searching for hundreds of migrants in the mediterran,1
8146,rescuers,Surabaya,video were picking up bodies from water rescuers are searching for hundreds of migrants in the mediterran,1
8147,rescuers,iminchina,video were picking up bodies from water rescuers are searching for hundreds of migrants in the mediterranean,1
8150,rescuers,Africa,durbanknight rescuers are searching for hundreds of migrants in the mediterranean after a boat carr,1
8155,rescuers,Nigeria,roddypiperautos fears over missing migrants in med rescuers search for survivors after a boat carrying as ma,1
8156,rescuers,Birmingham,andygilder channel 5 have been doing the same for the rspca with dog rescuersthe infomercial has crept in the back door,0
8162,rescuers,London,video were picking up bodies from water rescuers are searching for hundreds of migrants in the mediterran,1
8170,rescuers,Thailand,video were picking up bodies from water rescuers are searching for hundreds of migrants in the mediterran,1
8172,rescuers,17th Dimension,ahmazing story of the power animal rescuers have a starving homeless dog with no future was rescued by a person,1
8176,rescuers,Washington,news many deaths in shipwreck rescuers are trying to save hundreds of migrants after the,1
8177,rescuers,USA Canada Europe Asia,video were picking up bodies from water rescuers are searching for hundreds of migrants in the mediterran,1
8180,rescuers,worldwide,video were picking up bodies from water rescuers are searching for hundreds of migrants in the mediterran,1
8181,rescuers,Phoenix,when rescuers found him he was barely alive but they had no idea he was allergic to this,1
8189,rescuers,Paris France,rescuers recover body of 37yearold calgary man from lake near vulcan,1
8191,rescuers,Here there and everywhere,video were picking up bodies from water rescuers are searching for hundreds of migrants in the,1
8195,riot,Belgrade,to all the meatloving feminists of the world riot grill has arrived pop quiz which do you prefer fem,0
8196,riot,India,stuart broad takes eight before joe root runs riot against aussies,0
8201,riot,Cardiff UK,piprhys i predict a riot,1
8204,riot,Bossland,,0
8205,riot,World Wide Web,to all the meatloving feminists of the world riot grill hasarrived,0
8208,riot,Uppsala Sweden,seriously do we have to do a tactical riot against the headquarters of disney and marvel,0
8209,riot,East London,daniriot keep an eye out well be looking for lots of new team members in coming daysweeks,0
8210,riot,Detroit MI,to all the meatloving feminists of the world riot grill has arrived pop quiz which do you prefer feminist,0
8217,riot,Los Angeles,retweeted sarah silverman sarahksilvermansoundtrack of my walk starts w tracey ullman they dont know perfect,0
8221,riot,Montana USA,i liked a youtube video,0
8223,riot,Utah USA,bytorrecilla torrecilla we always info the secret on lol game check the secret to get 600000 riot points on my bio,0
8224,riot,Frankfort KY,transwomen and drag queens of color lead the riot a well known butch lesbian is usually credited for inciting it,0
8225,riot,Los Angeles,eac4au you can now preorder the film on itunes amp watch 915 yay,0
8226,riot,UK,without an ally near you cant use this skill how did you get hired really cause its making every riot staff member look incompetent,0
8231,riot,In Space,pop quiz which do you prefer feminist revolution or fried ravioliwith porcini and ricotta,0
8234,riot,Sligo and Galway Ireland,davidjordan88 stephanenny except we dont know who started the riot or if it even makes sense to credit any particular individuals,1
8235,riot,Los Angeles,trollkrattos juan carlos salvador the secret tips to get 100000 riot points lol are out now check the secret on on my bio,0
8236,riot,Seattle,southeast dirt riot series crowns champions southeast dirt riot series crowns championsblackfoot id the so,0
8237,riot,Tipperary Long Way,sweetpeas are running riot at the allotment and brightening up a rainy day,1
8239,riot,Malang,riot police intervene after southampton and vitesse arnhem supporters clash fans clash in buildup to second,1
8241,riot,San Francisco,cracker white riot,0
8242,rioting,hertfordshire,but the government will not care police will stop rioting eventually of protestors eventually some skyscrapers become plantcovered,1
8243,rioting,Dublin,new doco tonight at 9pm setanta sports ireland freeview the largest police presence at a soccer game in ireland stop prevent the rioting,0
8245,rioting,Spare Oom,if they kill off val im rioting emmerdale,0
8246,rioting,SURROUNDED BY WEEABOOS,money cant buy happiness is just a lie we tell poor people to keep them from rioting,1
8250,rioting,Australia,twitter is doing a count down to the rioting and financial collapse of brazil rio2016,1
8252,rioting,New York,runjewels recently met with the bbc to discuss race relations in america amp the benefits of rioting loveislove,0
8253,rioting,Vidalia GA,reuters people like you should be charged after the inevitable rioting for contributing to it with your lies,0
8254,rioting,Vista CA,,1
8256,rioting,Serva Fidem,leeds fan rioting in embra at a lower tier league cup final dee dum,1
8258,rioting,Bellville Ohio,cloydrivers there were plenty of black people rioting when tosu won the championship as well,0
8259,rioting,trapped in America,evacide the ferguson riots worked this of this the next time you say rioting doesnt change anythingthere fixed it for you,1
8261,rioting,A little house in the outback,bbcnews the ass of british insurers says rioting will cost insurers amp163163millions but police numbers are reduced by blind fat contr,1
8262,rioting,tri state,bhramabull watch run the jewels use facts to defend rioting in ferguson the socially minded duo takes on the,1
8264,rioting,Upstate New York,i think twitter was invented to keep us insomniacs from rioting in the wee small hours,0
8270,rioting,Scotland United Kingdom,jasalhad brianboru67 jimskiv92 hijinks1967 rioting,1
8276,rioting,Chicora Oakland,davidolszak or the rioting in happy valley after penn state loses,0
8280,rioting,heart of darkness unholy,georgous what alternatives legal alternatives protesting rioting may not be the most peaceful thing but its a demonstration of how,0
8283,rioting,Colonial Heights VA,halljh1720 i am so sick of criminals parents and friends rioting when they are killed by police you dont give a damn when officer is,1
8285,rioting,India,the ashes test match is currently more interesting than stupid congress rioting,1
8286,rioting,The Weird Part of Wonderland,people rioting everywhere and i think id be one of themusamisan lt3,1
8288,rioting,Alabama,,0
8289,rioting,A little house in the outback,am bbcnews the ass british insurers says rioting will cost insurers163millions but police numbers are reduced by blind fat controllers,1
8291,rioting,Cassadaga Florida,fa07af174a71408 i have lived amp my family have lived in countries where looters were shot on sight where rioting wasnt tolerated why here,1
8292,rubble,Columbus Georgia,refuse to let my life be reduced to rubble when the shit keeps piling up get a shovel expirehc,0
8294,rubble,Minna Nigeria,chinas stock market crash are there gems in the rubble chinas stock market crash this su,0
8301,rubble,AccraGhana,360wisenews chinas stock market crash are there gems in the rubble,0
8304,rubble,World,forbes chinas stock market crash are there gems in the rubble chinas stock market crash this summer ha,0
8309,rubble,Dubai UAE,forbes europe chinas stock market crash are there gems in the rubble,1
8311,rubble,Phoenix Az,jasonpope2 johnfugelsang again i didnt say it was i was referring to the main 2 buildings 7 was hit by rubble,1
8312,rubble,Italy,chinas stock market crash are there gems in the rubble,0
8314,rubble,London,360wisenews chinas stock market crash are there gems in the rubble,1
8317,rubble,ON,chinas stock market crash are there gems in the rubble,1
8318,rubble,St Louis MO,steve buscemi was a firefightr b4 fame amp workd 12hr shifts diggin thru wtc rubble lookg 4 survivors,1
8320,rubble,USA,chinas stock market crash are there gems in the rubble,0
8321,rubble,Spain China Latin America,chinas stock market crash are there gems in the rubble chinas stock market crash this summer h,0
8324,rubble,Chester IL,i found a diamond in the rubble,0
8329,rubble,West Africa,tnn chinas stock market crash are there gems in the rubble,1
8330,rubble,Calgary,chinas stock market crash are there gems in the rubble,1
8332,rubble,California,chinas stock market crash are there gems in the rubble,0
8334,rubble,Made Here In Detroit,360wisenews chinas stock market crash are there gems in the rubble,1
8335,rubble,Portland,new post chinas stock market crash are there gems in the rubble,0
8339,rubble,Dallas Tejas,photo postapocalypticflimflam prodding around the rubble,0
8341,rubble,ATLANTA GEORGIA,360wisenews chinas stock market crash are there gems in the rubble,0
8344,ruin,CA GA,okgabby damn suh dont let that ruin your year bruh this our year better start carpooling like we did back in the day,0
8345,ruin,Nashville,if i cant ruin his mood then i may have lost my direction,0
8347,ruin,Depok,quote never let your problems ruin your faith,0
8348,ruin,London Birmingham,im so anxious though because so many ppl will me watching me meet them and that makes me uncomfortable but i cant let that ruin the moment,0
8349,ruin,texas,smokers that ruin that new car smell,0
8350,ruin,Yulee FL,chrisdyson16 just wait until your friends at mta ruin it sorrybutitstrue,0
8351,ruin,austin tx,im really sad about red 7 closing yuppies n tourists ruin everything,0
8356,ruin,Garrett,like why on earth would you want anybody to be unhappy dont purposely ruin somebody elses happiness,0
8360,ruin,followurDREAMS my instagram,fresh out da shower lookss still loving this new hair does it ruin my brand yes,0
8362,ruin,sheffield rotherham,well done me everyone applaud me and how terrific i am and how i never ruin anything,0
8363,ruin,Wailuku Maui,four things that may ruin your personal injury accident claim,1
8365,ruin,Lima OH,every time i have a really good day someone just has to ruin it,0
8366,ruin,Long Beach CA,you wanna ruin a relationship just ask what are your intentions and youll do it,0
8367,ruin,Belfast,and then i go a ruin it all with something awful minions,0
8368,ruin,fujo garbage heaven,it was really awful and i cant even work with a make up artist now because they will ruin things,0
8369,ruin,Connecticut,damn wale knows how to ruin a song,0
8371,ruin,snapchat maddzzbabby,why does my family have to ruin something that is actually going good for me,0
8372,ruin,2360 miles away,i hate that im so awkward and i ruin things,0
8375,ruin,Winnipeg Manitoba,why do u ruin everything 9tarbox u ruined the sour cream and u put a brick of cheese in the freezerdummy,0
8378,ruin,Boston,lol the real issue is the the way the nfl is trying to ruin this guys legacy,0
8382,ruin,Florida Forever,rt to ruin connormidd s day,0
8383,ruin,Sacramento,greedy bastards fullscreen way to ruin creativity censorship on youtube,0
8385,ruin,RedSoxNation,juliechen she shouldnt being with them is gonna ruin her game and vanessa is a great player,0
8386,ruin,MNL,clnv yes yes i will i dont wanna ruin my life lol,0
8387,ruin,youtubecomchannelUCHWTLC9B4ZjUGh7yDlb55Iw,nbc i wanna see you reboot the fresh prince of belair bring back the original cast and everything amp do nothing that will ruin the show,0
8389,ruin,CA DC,there are a few people id let ruin my life my soul my cervix my everything odell is definitely top of that list,0
8390,ruin,Des Moines IA,ill ruin my life if i have to,0
8391,ruin,Mrida Yucatn,babe im gonna ruin you if you let me stay,0
8392,sandstorm,Scituate MA,ctaztrophe31 everything must be ok because shes listening to sandstorm now,0
8393,sandstorm,USA,watch this airport get swallowed up by a sandstorm in under a minute,1
8396,sandstorm,USA,hienshi gbay99 it wouldnt turn into a sandstorm if riot gave a good answer instead they gave dumb excuses at least new client is there,0
8399,sandstorm,USA,i liked a youtube video,0
8400,sandstorm,USA,watch this airport get swallowed up by a sandstorm in under a minute,1
8401,sandstorm,hkXfYMhEx,watch this airport get swallowed up by a sandstorm in under a minute,1
8402,sandstorm,USA,watch this airport get swallowed up by a sandstorm in under a minute,1
8404,sandstorm,USA,watch this airport get swallowed up by a sandstorm in under a minute,1
8405,sandstorm,USA,watch this airport get swallowed up by a sandstorm in under a minute,1
8408,sandstorm,Hamilton County IN,sandstorm woo hoo,1
8409,sandstorm,USA,watch this airport get swallowed up by a sandstorm in under a minute,1
8410,sandstorm,USA,watch this airport get swallowed up by a sandstorm in under a minute,1
8411,sandstorm,USA,watch this airport get swallowed up by a sandstorm in under a minute,1
8412,sandstorm,USA,watch this airport get swallowed up by a sandstorm in under a minute,1
8415,sandstorm,Dakar,socialwots globiinclusion rt nrcmiddleeast sandstorm engulfs caravans and tents in the zaatari refugee camp,1
8416,sandstorm,USA,watch this airport get swallowed up by a sandstorm in under a minute,1
8418,sandstorm,USA,watch this airport get swallowed up by a sandstorm in under a minute,1
8419,sandstorm,USA,watch this airport get swallowed up by a sandstorm in under a minute,1
8422,sandstorm,USA,watch this airport get swallowed up by a sandstorm in under a minute,1
8423,sandstorm,USA,watch this airport get swallowed up by a sandstorm in under a minute,1
8425,sandstorm,In your head,sundercr two hours of sandstorm remixes all merged together no betweensong silence,0
8428,sandstorm,USA,watch this airport get swallowed up by a sandstorm in under a minute,1
8430,sandstorm,North Carolina USA,put sandstorm down,0
8431,sandstorm,USA,watch this airport get swallowed up by a sandstorm in under a minute,1
8432,sandstorm,USA,watch this airport get swallowed up by a sandstorm in under a minute,1
8433,sandstorm,USA,watch this airport get swallowed up by a sandstorm in under a minute,1
8434,sandstorm,WA State,come out to sandstorm tryouts aug 15th at lower woodlandms tryout 3430pmhs tryout 4306pm,1
8435,sandstorm,USA,watch this airport get swallowed up by a sandstorm in under a minute,1
8436,sandstorm,The Sanctuary Network Rome,villicanaalicia is it darude sandstorm,0
8437,sandstorm,Tractor land aka Bristol,i cant listen to darude sandstorm without expecting airhorns now,0
8441,sandstorm,USA,watch this airport get swallowed up by a sandstorm in under a minute,1
8444,screamed,Adventuring in Narnia,infinitegrace7 i just screamed to the world how much i love my little pony,0
8448,screamed,Asgard,godofmischief of lokis daggers she pulled it out and jammed it into minas thigh when mina screamed and grabbed at her leg sif,1
8450,screamed,San Diego,omfgdidnt expect drag me down to be the first song pandora played omfg i screamed so loudmy coworker is scared,1
8451,screamed,Unite Bless Wallahi,she screamed when she got the microchip needle tbh i would have cried too the needle was massive ya haram,0
8453,screamed,sneaking glances at Thancred,mogacola zamtriossu i screamed after hitting tweet,0
8454,screamed,ljp4,the girls next to me screamed what the fuck is a chonce im cryibg,0
8455,screamed,Charlotte North Carolina,i thought the loudest goal i ever screamed was higuains offside goal against germany,0
8459,screamed,Nirvana,cortezera i dead ass screamed when we signed him i couldnt fucking believe it,0
8463,screamed,ny,brooke just face timed me at the concert and just screamed for 2 minutes straight,0
8464,screamed,Mentor OH,wants to make tweet about how much i dislike todays femnism movement but doesnt want to be screamed at,0
8468,screamed,Trumann Arkansas,26 people have screamed right in my ear this week at camp twentysix and we still have 12 day left cedarglade2015,0
8471,screamed,18 CC,some kids going to leadership camp came into my work today asking for the bathroom and my inner asb kid screamed a lot i miss camp,0
8472,screamed,North Carolina USA,vacation update my great aunt just killed a spider with her bare hand after i screamed in fear fierce,1
8476,screamed,1D 5SOS AG,i just screamed in 57 languages this is so good,0
8477,screamed,PAUSA,i screamed at the end oamsgajagahahah im laighign otrametlife,0
8478,screamed,m3 k a d,i have never screamed so loud,0
8480,screamed,pissing off antis,i screamed whats a chonce,0
8483,screamed,SAN ANTONIOOOOO,realliampayne i screamed at the top of my lungs when you said you guys would come back to sa so keep your promise addtexastonext1dtour,0
8486,screamed,sisterhood,arianagrande i literally walked out of the concert and screamed my soul has been blessed,0
8487,screamed,3000 miles from everyone,i just screamed what the fuck is a hond,0
8489,screamed,livin in a plastic world,i just screamed toddyrockstar,1
8490,screamed,with Doflamingo,kinda screamed gtlt,0
8497,screaming,21 Porto,im screaming and fangirling oh my god,0
8498,screaming,access to njh5 and cth4,during drag me down last night i was screaming shell of a mannequin instead of shell of a man and i think everyone hated me there,0
8500,screaming,tx,camilacabello97 internally and externally screaming,1
8504,screaming,tx,camilacabello97 now im internally screaming,0
8505,screaming,Massachusetts,estellasrevenge the first time i went swiming in it i was basically screaming why does it smelltaste so bad,0
8506,screaming,rio de janeiro brazil,screaming mariahcarey arianagrande,0
8508,screaming,Moore OK,noahshack hes hot amp he can sing im screaming,0
8509,screaming,OlderCandyBloom,its fine baby i was screaming at the tv x,0
8511,screaming,Justin and Ariana follow,my favs im screaming so fucking loud,0
8512,screaming,blackparavde is my frankie,tyleroakley im screaming,0
8513,screaming,Daddy Kink Central,scalpium screaming,0
8515,screaming,Wakefield West Yorkshire,stvmlly sorry for screaming at you and safferoonicle from the car i just kinda i know those people lets yell,0
8516,screaming,Pittsburgh,my dad a screaming coach always gave his vocal chords quite the workout on the field,0
8517,screaming,Namjoons pants,54 9 how do people not know who kendall jenner is she has 6 times the instagram followers of gd screaming lmao,0
8518,screaming,Mogadishu New Jersey,missdaoh and if she had a screaming baby you would have loved that so much more,0
8520,screaming,All around the world,arianagrande justinbieber im screaming omg idols 22days wdym,0
8522,screaming,Jariana Town,justinbieber arianagrande can you hear me screaming,0
8523,screaming,New York,kamkasteiiano bluntedjayt fucking screaming,0
8524,screaming,Honeymoon ve,arianagrande justinbieber all the loves be screaming at this one,0
8526,screaming,Aveiro Portugal,hey there lonely girldid you have to tell your friendsabout the way i got you screaming my name,0
8531,screaming,justin ari follow tvd,justinbieber arianagrande screaming,0
8533,screaming,UK,blanksocietyx emmerdale im screaming hes my favourite,0
8538,screaming,9113,screaming in 22 different languages,0
8539,screaming,JDBLJCAGBTWPLL,justinbieber i am screaming hell yes ahhhh omg,0
8540,screaming,nap queen,like little boy you better sit your ass down stop screaming at my mother stop pulling your hair amp crying like a 3 year old amp grow tf up,0
8541,screaming,amsterdayum 120615 062415,arianagrande justinbieber omgggg im screaming,0
8542,screams,lesa sheher,trombonetristan ooooohshit ooohshit screams hell i love,0
8543,screams,Griffin 3,danemillar1 screams 666,0
8545,screams,xiumins nonexistent solos,screams in the distance,1
8547,screams,marvel books hp tmr,screams in 25 different languages,0
8550,screams,Pennsylvania,screams internally,0
8551,screams,blackfalds,screams,0
8553,screams,San Juan Puerto Rico,himeruisu im going to ram your ass so hard ill have to shove your face on the pillows to muffle your screams of pain and pleasure,0
8556,screams,New Jersey,he hit a tailor fucking made double play and kay screams he was robbed of a hit,0
8558,screams,Freddy Fazbears pizzeria,drag0nking0201 screamsdont scare me and its animatronics,0
8560,screams,Braslia,still echoes of their screams,0
8561,screams,POFFIN,in every bts song jimin screams,0
8562,screams,Gladiator 860757,casually on the phone with jasmine while she cries and screams about a spider,0
8567,screams,WITS Academy,realjaxclone screams,0
8571,screams,Where ever i please,sakuuchiha yaboiluke screams and gets a face full of saku genitals,0
8577,screams,Melbourne,ollymursaus i do feel sorry for him he is not a piece of meat he is a nice guy people dont need to rush him and screams in his face,1
8578,screams,SheffieldLeeds,i agree with certain cultural appropriation things but honestly if u looked at my house it screams appropriation bc buddhas and stuff,1
