id,keyword,location,text,target
2542,collision,60th St SS,head on head collision ima problem and nobody can solve em on long division,0
2543,collision,San Francisco,solano sr37 skaggs island rd trfc collision1141 enrt,1
2544,collision,Sacramento,traffic collision no injury i5 s at i5 s 43rd ave offramp south sac,1
2545,collision,Ontario,cleared collision qew fort erie bound approaching hwy 405 niagaravehicles removed ag,1
2546,collision,Denver Colorado,motorcyclist bicyclist injured in denver collision on broadway,1
2547,collision,Denver Colorado,motorcyclist bicyclist injured in denver collision on broadway,1
2548,collision,Sacramento,south sac i5 s i5 s 43rd ave ofr trfc collisionno inj,1
2550,collision,USA WA,anti collision rear gadget technology,0
2552,collision,btwn a rock and a hard place,sometimes in space celestial bodies with separate trajectories that intertwine find themselves in a dance rather than a collision course,0
2556,crash,Tennessee,just bought another meinlcymbals 18 medium crash hey meinlcymbals what about an endorsement starting to get expensive,0
2561,crash,AixenProvence France,daewony0406 alright now im gonna crash im so exhausted,0
2564,crash,Liverpool,party for bestival crash victim michael molloy on what would have been his 21st,1
2565,crash,I75 in Florida,cleared crash in hamilton on i75 south at mm 459,1
2568,crash,21462446158022017,the next financial crash the writing is on the wall dont say you werent warned,0
2569,crash,Cleveland OH,am boy crash,0
2571,crash,Melbourne,incidentcrash in pascoe vale south outbound on tullamarine fwy citylink near moreland rd vehicles off in emergency lane no delays,1
2573,crash,Darlington,if you sit and rant on snapchat to your apparent fans when you have about 8000 followers i hope your in a train crash xoxo,0
2579,crash,Melbourne,destinythegame bungie playstation getting kicked out by that crash is one of the worst experiences ive had playing video games,0
2582,crash,Kenton Ohio,chelsdelong12 kendraleigh13 ill crash it,1
2585,crash,Galatians 220,please keep josh the salyersblairhall families amp jennas friends in your prayers she was taken far too soon rip,0
2588,crash,Charleston SC,fatal crash reported on johns island,1
2593,crash,Lancaster Pennsylvania USA,police respond to crash find suspected heroin,1
2597,crash,In my own world,akilah world news cop pulls man from car to avoid this,1
2602,crash,San Francisco,crash test trailer paul scheer amp rob huebels comedy special recorded on a,0
2603,crashed,Definitely NOT the stables,spicybreads coxytown i tried downloading it and it crashed after the tutorial,0
2604,crashed,Pakistan,maj muzzamil pilot offr of mi17 crashed near mansehra today,1
2605,crashed,Cuernavaca Morelos Mxico,,1
2608,crashed,Scotland,neileastwood77 i am a knobhead bin laden family plane crashed after avoiding microlight and landing t,1
2614,crashed,Va Beach Virginia,uk bin laden family plane crashed after avoiding microlight and landing too far down runway three members,1
2616,crashed,52479722 62184971,rosewell it has crashed so many times the past couple hours,0
2617,crashed,The Pig Sty,gt bin laden family plane crashed after avoiding microlight and landing too far down runway,1
2621,crashed,Bangor CoDown,johndcgow heard this few days ago while driving and near crashed the car from laughing to much,0
2622,crashed,Weston super mare,olliebailey11 havnt you crashed,0
2625,crashed,Victoria Tx,intactmh370partliftsoddsplaneglidednotcrashedintosea,1
2627,crashed,Pakistan Islamabad,pak army helicopter crashed in mansehra,1
2628,crashed,Lincoln NE,1 the bug that almost crashed the euro,1
2632,crashed,London,this guy bought my car on tuesday police knocked my door yday cos he crashed n ran amp 2day he text me asking not to send the log book,1
2633,crashed,Gujranwala Pakistan,maj muzzamil pilot offr of mi17 crashed near mansehra today may almighty give strength to family to bear the loss,1
2635,crashed,Lindenhurst,thief broke front window of hicksville store stole 50 cell phones fled crashed into,0
2637,crashed,Islamabad,army sources say 12 persons on board including a team of doctors die in helicopter crashed near mansehra weather seems to be cause of crash,1
2640,crashed,Somewhere,smusx16475 skype just crashed u host,0
2642,crashed,too far,he was only 4 of a second faster than me and i overtook him twice then crashed tru luv lt3 lt3,0
2643,crashed,Kingswinford,i just nearly crashed my car typing paul rudd attacked by flying ants into notes on my phone,0
2644,crashed,i love the smurfs 2,honestly nightmarish god driving to new places is always stressful as shit amp i hate it so much ugh almost crashed a few times,0
2648,crashed,International,ttw todays news bin laden family plane crashed after avoiding microlight and landing too far down runway,1
2649,crashed,Viterbo BFA Acting 18,heard skh on the radio for the first time almost crashed the car 5sos ashton5sos luke5sos michael5sos calum5sos,1
2651,crashed,Buenos Aires,mh370 intact part lifts odds plane glided not crashed into sea,1
2655,crush,Kaneohe,kuualohax more like you love your husband but youre posting another man for your man crush mondays lol,0
2656,crush,Houma La,womem crush wednesday mommyisbomb,0
2659,crush,EastAtlanta WestGeorgia18,wce i cant even lie even tho i cant stand her she still will always be my crush explicitpretty,0
2660,crush,San Antonio TX,women crush,0
2661,crush,Cleveland Ohio,my woman crush wedneday goes to the beautiful taykreidler loveyouuuu aintsheperty,0
2666,crush,Worldwide,samelsamel has a crush,0
2668,crush,San Diego Texas,love love love do you remember your first crush,0
2670,crush,GLOBAL,had a minute alone with my crushit was an overrated experiencesmh,0
2671,crush,05042014 1823,pydisney que crushmtvhottest justin bieber,0
2672,crush,Worldwide,master0fsloths has a crush,0
2676,crush,Bolivar MO,when youre girlfriend is completely gorgeous woman crush amp stuff,0
2677,crush,taking pain like pleasure,im so high moe im bouta crush this fridays,0
2679,crush,San Fransokyo,i have the biggest crush on you amp i dont know if youll ever know it,0
2680,crush,Washington,mrrobinson is giving me thesteveharveyshow vibe music teacher looks out for students has crush on girl he went to high school with,0
2684,crush,Worldwide,yhngsjlg just tweeted about their secret crush,0
2687,crush,Miami FL,starflamegirl yeah i have a crush on her,0
2689,crush,Utah,crush content marketingmediocrity,0
2692,crush,Worldwide,sevenfigz has a crush,1
2694,crush,Worldwide,tiffanyfrizzell has a crush,0
2695,crush,w Nykae,more than a crush wce nykaed,0
2696,crush,honeymoon avenue,jaureguiswisdom lmao well i only know one and ive only had a crush on this one sooo,0
2698,crush,Toronto Worldwide,nowplaying fitz and the tantrums out of my league on crush listen,0
2707,crushed,11414,that was crushed holy shit,0
2708,crushed,wherever theres netflix,bhavanas mom has crushed everyones soul,0
2714,crushed,Chicago,jimmyfallon i crushed squirrel bones with a mortar and pestle for my schools bio dept not really sure why worstsummerjob,0
2715,crushed,HAMont,edwin wow crushed,0
2720,crushed,UK,man crushed to death by own car,1
2723,crushed,ph,a diamond is just a piece of charcoal that handled stress exceptionally well we are hard pressed on every side but not crushed2 cor48,1
2726,crushed,online,wrapup 2us cable tv companies shares crushed after disney disappoints,0
2728,crushed,Conroe TX,cbsbigbrother ouch clelliyou could almost hear their hopes and dreams being crushed,0
2729,crushed,Ontario,jesus christ that ball was fucking crushed bluejays,0
2730,crushed,Guayaquil,i crushed a 31 km run with a pace of 541 with nike sportwatch gps nikeplus,0
2731,crushed,bahstunporta reeko,papi absolutely crushed that ball,0
2732,crushed,Bucks County Pa,crushed a 6 mile run tonight awesome,0
2733,crushed,Sunny South florida,wrapup 2us cable tv companies shares crushed after disney disappoints,0
2734,crushed,Rio,oil prices falling but drivers could reap benefits,0
2736,crushed,Neverland,i crushed a 112 km run with a pace of 746 with nike sportwatch gps nikeplus,0
2739,crushed,Pennsylvania,nick williams just hit another bomb just crushed it,0
2744,crushed,Trinidad Tobago,disillusioned lead character checkhappy go lucky free spirit girlcheckdream life crushedcheckgreat musiccheckall crowe tropes intact,0
2748,crushed,Chicago Lake Buena Vista,remember how nora jones crushed it in two weeks notice,0
2749,crushed,Toronto Ontario,how empire avenue crushed my soul,0
2752,crushed,Liberty Lake WA,13 m chapoutier crozes hermitage so much purple violets slate crushed gravel white pepper yum france wine dc,0
2755,curfew,Ankara Malatya ad Orontem,ara news reporting jan fighters infiltrated ashrafiyah district of afrin with aim of carrying out suicide attacks ypg have imposed a curfew,1
2758,curfew,antioch california,michelleellle shut up freshman its past ur curfew u need some sleep u spend too much of ur time watching tv instead of going outside,0
2759,curfew,State College PA,is there a night curfew on campusfind out here,0
2760,curfew,Chicago,police teenagers arrested for curfew violations in evanston were riding stolen bicycles two teenagers taken into cus chicago news,1
2763,curfew,somewhere in cali,bobbyxfisher i shouldve gave him a curfew,0
2765,curfew,Im Around Jersey,curfew really helps if you think about it bc,0
2766,curfew,Garden Grove,exofficio mens boxer brief curfew large,0
2767,curfew,Adelaide,info s wnd 0306 cld sct014 bkn032 exp inst apch rwy 05 curfew in oper until 2030 z taxiways foxtrot 5 amp foxtrot 6 navbl tmp 10,0
2770,curfew,BKIKUA,her curfew will start right after her private class ends tutor must a woman preferably someone over 50,0
2773,curfew,urnus,it was past curfewand we were at the grove,0
2774,curfew,Illinois USA,emmychappy because its 12 oclock and my mom said everyone has to go home because of curfew,1
2777,curfew,AAS my Aztec Princess,reddakushgodd she said a few months but i get a curfew for out time smfh,0
2778,curfew,turner fenton,ball has no curfew,0
2782,curfew,KLAUganda,next may ill be freefrom school from obligations like family best of all that damn curfew,1
2783,curfew,Uganda,daviskawalya i know mauryn143 will be saying her final goodbyes to grandpa as seen on news rip me always open to ideas but may ve curfew,0
2785,curfew,253,stupidniggr im telling your mom your up past curfew oth,0
2786,curfew,Elkhart IN,had to cancel my cats doctor appointment because she decided to go out and play and not come home by curfew,0
2787,curfew,Adelaide,info r curfew in oper until 2030 z taxiways foxtrot 5 amp foxtrot 6 navbl wnd 0605 exp inst apch rwy 05 damp tmp 10 qnh 1028,0
2788,curfew,California,but no lies though its pays to be the oldest sometimes like being the first to get a car and have no curfew freedom donthate,0
2792,curfew,Adelaide,info u cld sct012 bkn025 exp inst apch rwy 05 curfew in oper until 2030 z taxiways foxtrot 5 amp foxtrot 6 navbl tmp 10 wnd 0306,0
2793,curfew,Pon Di Gully,rite now man a tlk widout nuh curfew long side aka cum fi steal di show itz a rubbery di whole a dem fi knw sound it music,0
2794,curfew,Benedict College,dont even come if you worried about curfew bc19,0
2795,curfew,HTX,you got a whole curfew,0
2797,curfew,IM LOST,da judge gave dis girl 5pm curfew,0
2799,curfew,Miami,in the beginning of summer my mom made my curfew 1 now its back to 12 and i can never go out and she wonders why im always at home,0
2802,curfew,Hamilton ON,when u bombed and u try 2 get home for curfew,0
2803,cyclone,UK,awwww baby walter rewatchingthepilot teamscorpion cyclone,0
2807,cyclone,Des Moines Iowa,the big ten has their annual football media day but before we get into that heres some cyclone hoops recruiting nuggets,1
2808,cyclone,USA,camera art photography 30,0
2811,cyclone,Rural Northern Nevada,mccauleysdesign abysmaljoiner dyamiplotke it works for my purpose a large cyclone would be better i just dont have 4k this was 500,0
2813,cyclone,Republic of the Philippines,a new tropical cyclone is forming near guamonce it is formed it will be called molave,1
2821,cyclone,Philippines,severe weather bulletin no 5for typhoon hannaph soudelortropical cyclone warningissued at 500 pm 06,1
2822,cyclone,Washington,the cyclone derives its powers from a calm center so does a person norman vincent peale,1
2825,cyclone,hyderabad,roughdeal1 ante hudhud cyclone chandrababu valle ne ante ga,1
2826,cyclone,Vancouver HQ and worldwide,cyclone komen devastates families in myanmar this week we need to help them today,1
2827,cyclone,Quezon City Philippines,severe weather bulletin 6tropical cyclone warning typhoon hanna issued at 1100 pm thursday 06 august,1
2828,cyclone,Geneva,back to the future in vanuatu how cyclone pam has encouraged traditional ways of living,1
2829,cyclone,Hartford connecticut,bank manager asks tom in an interview what is cyclonetom it is the loan given to purchase a bicycle,0
2830,cyclone,Sioux Falls SD,excited for cyclone football,0
2831,cyclone,Cornwall,bbc forced to retract false claims about cyclone pam,1
2832,cyclone,Beside Basketball,talent misdirection cyclone pass ignite pass vanishing drive phantom shot kurokobot,1
2833,cyclone,Rome,now on comdev asia radio stations in bangladesh broadcasting programs to address the upcoming cyclone komen,1
2835,cyclone,Tafekop GaMatsepe,like a cyclone imperialism spins across the globe militarism crushes peoples and sucks their blood like a,1
2843,cyclone,Melbourne,cyclonereizei if i may ask cyclonesama have you read jailed fate by rindou,0
2844,cyclone,Vilnius,some drugs and alcohol in jackson vroman house,0
2846,cyclone,Geneva,blending the old with the new in vanuatu to prepare for future emergencies,0
2852,cyclone,Made in America,cyclone by double g would be the cherry on top to this outfit ootd doubleghats,0
2853,damage,PS4 now stop asking,thelegendblue cozmo23 theyll probably allow us to ascend them but not get them to the damage max values,0
2855,damage,Cheshire London allover,unions say they are supportive of london yet are prepared to damage it economically 300m last time,0
2856,damage,Texas,i liked a youtube video,0
2857,damage,Bartholomew County Indiana,fyi accident property damage3460 limestone lncolyellowstone wayfieldstone dr08052015 193635,1
2858,damage,USA,fitness knee damage solution,0
2860,damage,My mind is my world,and here i was complaining about phoenix mode in fire emblem turns out ray gigant will have a difficulty option where you take 0 damage,0
2863,damage,Catskills,cleared accident with property damage on ny35 eb at ny 100,1
2865,damage,Columbia SC,writebothfists it got pretty windy here too but no damage,0
2867,damage,Right here,indigo6e but if you are carful about spotting damage the time of check in why not the time of giving away baggage its my loss all d wy,0
2869,damage,Texas,storm damage reported in west tennessee,1
2870,damage,Lawrence KS via Emporia KS,hey the royals love doing damage with 2 outs,1
2872,damage,Indonesia,mages of fairy tail specialize in property damage natsu dragneel,0
2873,damage,Unknown,bradleybrad47 yeah but being fast and doing extremely high damage is what its all about if you want fast then im gonna have to get u the,1
2875,damage,Unknown,bradleybrad47 the saw is fast af and does great damage i upgraded it a shitton and used it exclusively for a whole playthrough,0
2877,damage,Marysville MI,lets say a tree falls on your fence do you know how your homeowners insurance may help,0
2878,damage,New Haven Connecticut,joedawg42 tor for a tor situation only wind damage enhanced wording is key imo,1
2880,damage,Austin San Diego,swb1192 if the nda is written to damage your ability to offer your services in the future then you prolly dont want the work anyway,0
2882,damage,Pontevedra Galicia,np metallica damage inc,0
2883,damage,Somewhere in the Canada,nine inmates charged with causing damage in calgary remand centre riot,1
2884,damage,LondonNew York,pt crosssectarian protest powerful shia cleric says militias must withdrawur fightin isis but we wont forget damage uve done to ur ppl,1
2885,damage,261 5th Avenue New York NY,does homeowners insurance cover water damage here are some good things to know,1
2889,damage,Charlotte,reported hit amp runin roadwayproperty damage at 15901 statesville rd,1
2891,damage,Rockville Maryland,glaucoma occurs when fluid builds up pressure inside eye to a level that may damage optic nerve eyefacts,1
2896,damage,Australia,thank you richarkkirkarch ausinstarchitect for words of warning re queenswharf brisbane,0
2898,damage,Your Conversation,this real shit will damage a bitch,0
2899,damage,USAoV,lmao fuckboy changed his for damage controlpseudojuuzo,0
2900,damage,Bhopal Madhya Pradesh India,michaelwestbiz standard damage control,1
2902,damage,Tennessee,gettinglost jennellensbb munclejim it said they had superficial wounds and it was the pepper spray that did the most damage,1
2907,danger,LemonGang,i believe there is a shirt company now for every animal that has ever been in danger i better start seeing some changes in wildlife,0
2908,danger,ayr,danger of union bears,0
2910,danger,Worldwide,dyannbridges yeshayad check out this rockin preview of claytonbryant danger zone coming soon,0
2911,danger,San Jose California,red flag warning for fire danger amp dry thunderstorms in bay area,1
2912,danger,Worldwide,carsonrex spaceangelseven check out this rockin preview of claytonbryant danger zone coming soon,0
2913,danger,Loughborough England,what is this like i could be in danger or something,1
2915,danger,Killarney,when the last tree is cut down the last fish eaten and the last stream poisoned you will realize that you,0
2916,danger,Brooklyn,my take away preservation parks r an imposition amp a danger to african people i never imagined,0
2917,danger,Lahar Gwalior,indian govt amp media should take serious concern about their safety they are in danger now,1
2920,danger,St Paul MN,training grains of wheat to bare gold in the august heat of their anger im the no trespass lest you seek danger,0
2921,danger,Atlanta,therealrittz fettilootch is slanglucci oppressions greatest danger coming soon the album,0
2924,danger,Lincoln IL,dont like those head first slides especially into home danger,0
2925,danger,World,permits for bear hunting in danger of outnumbering actual bears the licenses for floridas fir,0
2927,danger,Spinning through time,riverroaming and not too much danger please,0
2929,danger,Atlanta,bluebirddenver fettilootch is slanglucci oppressions greatest danger coming soon the album,1
2931,danger,Boston,uber is looking to repair its recent bad rap with some nonprofit partnerships,0
2932,danger,Hailing from Dayton,i wish i could get victorias secret on front im good for it,0
2933,danger,Worldwide,turnedonfetaboo hsjb215 check out this rockin preview of claytonbryant danger zone coming soon,0
2934,danger,Newcastle Upon Tyne,thetxi gunnersfan89 why would arsenal fans want that west ham will be in a relegation battle this season no danger for afc on sun,0
2935,danger,Atlanta,remainontop fettilootch is slanglucci oppressions greatest danger coming soon the album,0
2936,danger,Atlanta,nuggets fettilootch is slanglucci oppressions greatest danger coming soon the album,0
2941,danger,Instagram trillrebel,guns are for protection that shit really shouldnt be used unless your life in danger,0
2942,danger,ALWAYS DYING NEVER RESTING,so thirsty yall in danger of dehydration,1
2943,danger,San Jose CA,thunderstorms with little rain expected in central california high fire danger weather cawx,1
2944,danger,2005,i wanna get a danger days tattoo so bad how cool would that spider look like on someones wrist or smth,0
2945,danger,Israel,in my experience if youre always angry and critical as a pundit you are in grave danger of going off the rails 1,0
2946,danger,Uruguay Westeros Gallifrey,i am not in danger skyler i am the danger,0
2947,danger,Kansas City MO,too dangerous for them but its ok for the rest of us to be in danger,0
2948,danger,Silver Spring MD,investigate why robert mueller didnt respond to my complaints since nov 2011 amp just left meson out her in danger,0
2950,danger,Jersey CI,honestly tho modibo maiga is stealing a living fuck all about him im past my best but still more of a danger than that fucktard coyi,1
2954,dead,Afghanistan,17 dead as afghanistan aircraft crashes an afghan military helicopter has crashed in a remote region of the s,1
2955,dead,Sweden,silent0siris why not even more awesome norse landscapes with loads of atmosphere and life than boringdead snotgreen wastelands,0
2959,dead,London,remember that time goku gave life to a dead birb what the hell goku,0
2960,dead,Orlando,naaa i bee dead like a legit zombie i feel every sore part in my body,0
2965,dead,Atmosphere,lmfao fucking luis hhahaha im dead,0
2970,dead,Glasgow,soapscoop i need you to confirm that ross is dead cause i dont trust anyone else yh,0
2974,dead,somewhere in Portugal,if its a war you came to see you will never see a waved white flag in front mei cant end up dead i wont be misled,0
2975,dead,South Stand,jones94kyle oh fuck sake he is dead,0
2976,dead,dundalk ireland,emmerdale is ross really dead askcharley,0
2983,dead,Sochi KDA RU,hlportal hello im looking for mod cold ice i saw it on your site but link to download dead maybe you have it and share with me thanks,0
2984,dead,T 2669580727837865,kg4vaal lmaovv hard the ny is the the new trend babalmaowelcome to nyozi kwaaaaadead,0
2987,dead,South Stand,jones94kyle now ive said all this hes dead and no one else dies,0
2988,dead,Youre not 19 forever,is ross dead noooooooooooo mikeparractor,0
2990,dead,Kettering OH,thinking of the time that my friend bailed the nite b4 a dead showwent alone amp had a great time all alone and free to dance front row,0
2991,dead,USA,typhoon soudelor taking dead aim at taiwan,1
2993,dead,Planet Earth,man found dead in demi moores swimming pool,1
2995,dead,Spare Oom,thats it val is dead im suing,1
3000,dead,USA,wyrmwood road of the dead 2014 was fucking awesome and it had an awesome ending too awesome one,0
3001,dead,Milton Keynes,cant believe ross is dead emmerdale mikeparractor emmerdale summerfate,0
3004,death,ATLAL,i hate to talking otp with my grandma i mean i love her as to death but she talk so damn much ssshhheeesshh,0
3005,death,UPTOWN,until my death ill forever rep the jets,1
3009,death,PROV,death threats on a nigga life well then we gon see,0
3010,death,Novi MI,adult dies of plague in colorado,1
3011,death,New York,xbox 360 pro console red ring of death full read by ebay,0
3012,death,Buenos Aires,going back to gainesville will be the death of me,1
3013,death,on the go,a year later ferguson sees change but asks if its real,0
3016,death,The UK,i liked a youtube video from jeromekem,0
3021,death,mpls,her loyalty mission involves her kicking a shitty nobleman to death i love this elven weirdo,0
3022,death,Kensington MD,,1
3023,death,BuffaloDC,kellkane thanks i narrowly averted death that was fun youre right,1
3026,death,Sylacauga Alabama,allahsfinest12 death to muslims,1
3036,death,USA,i had no issues uploading death to smoochy or awakenings clips to youtube but for some reason bicentennial man is being a pain in the ass,0
3037,death,To The Right of You,ted cruz bashes obama comparison gop to iranians shouting death to america,1
3038,death,Cyprus,cyprus news analysis mullah omars death may split talibans ranks omars demise would certainly lead,1
3039,death,kansas,i feel like deathholy molys,0
3042,death,Los AngelesCA USA,video slain mexican journalist unknowingly predicted his own death,0
3043,death,Portland,there is this old lady rockin out to death metal in her sedan downtown smoking a cigarette i found my real mom,0
3044,death,Carry On Jutta,afghan peace talks in doubt after mullah omars death financial times mullah,0
3045,death,Home of the Takers,yall pusssssssssy and shoook to death of me,0
3047,death,New York,the first trial in the death of cecilthelion was just postponed,0
3049,death,sss a,aris hints and snippets will be the death of me,0
3051,death,Chicago,tomorrow will be the death of me,0
3052,death,Alicante Spain,new nyc legionnaires disease death toll rises,1
3055,deaths,Mooresville NC,dont get on i77 south huge wreck and airlift and maybe some deaths interstate is completely blocked,1
3056,deaths,Mooseknuckle Maine,lolgop 22 cases of voter fraud a year we need new laws83 gun deaths a day who actually follows laws amiritevra50,1
3057,deaths,Palermo Sicily,silence palermo shipwreck children deaths,1
3059,deaths,AsuncinPY TbingenGER,breast milk is the original superfood but rates worldwide have stalled below 40 contributing to more than 800000 child deaths last year,0
3060,deaths,Voorhees NJ,12 of the deaths in redlight running crashes are pedestrians bicyclists amp other vehicle occupants that are hit by the redlight runners,1
3066,deaths,UK,500 deaths a year from foodborne illness frackfreelancs dears deccgovuk frackfreeeu tarletonsophie,1
3068,deaths,Atlanta,hear drfriedencdc talk on how to avoid thousands of resistant infectionsdeaths in next 5 yrs,0
3070,deaths,Planet Earth,irony just died a thousand deaths,0
3071,deaths,Wakanda,strickskin nickscomics lol usually but im being objective here maybe uncle ben of course most deaths end up business as usual,0
3072,deaths,Lagos,comment deaths of older children what do the data tell us nghlth,1
3073,deaths,Does it really matter,deaths 7,1
3075,deaths,Your screen,real magic in real lifewomen went missing in ohio town the focus of fbi probe after strange deaths and,1
3077,deaths,Phoenix AZ,no two cases dont constitute an epidemic,1
3079,deaths,Does it really matter,deaths 3,0
3080,deaths,Edinburgh,had lunch with stewart amp julian only a couple of hours earlier good to finally find out what happened to them,0
3082,deaths,Weyburn,weyburn police warn public after fentanyl deaths in province,1
